20:57:16.351945 ARP, Request who-has 10.7.3.31 tell 10.7.3.50, length 46
20:57:16.351947 ARP, Request who-has 10.7.3.125 tell 10.7.3.50, length 46
20:57:16.371941 IP 10.7.0.251.netbios-ns > 10.7.3.255.netbios-ns: NBT UDP PACKET(137): QUERY; REQUEST; BROADCAST
20:57:16.572547 IP 10.7.2.207.mdns > 224.0.0.251.mdns: 0*- [0q] 18/0/0 TXT "model=J33iAP", PTR _touch-able._tcp.local., PTR 5D1A9CA4F892AE29._touch-able._tcp.local., PTR _appletv-v2._tcp.local., PTR 5D1A9CA4F892AE29._appletv-v2._tcp.local., PTR 5D1A9CA4F892AE29._appletv-v2._tcp.local., TXT "deviceid=6C:94:F8:CF:0B:0F" "features=0x5A7FFFF7,0x1E" "flags=0x44" "model=AppleTV3,2" "pk=784aa331328c903ae2322adf39af17413bcd613da1de7bef5bfe03e6ee486db2" "pi=c8f58144-d619-45ca-8deb-8631de05c2f2" "srcvers=220.68" "vv=2", TXT "cn=0,1,2,3" "da=true" "et=0,3,5" "ft=0x5A7FFFF7,0x1E" "md=0,1,2" "am=AppleTV3,2" "pk=784aa331328c903ae2322adf39af17413bcd613da1de7bef5bfe03e6ee486db2" "sf=0x44" "tp=UDP" "vn=65537" "vs=220.68" "vv=2", SRV Apple-TV.local.:7000 0 0, SRV Apple-TV.local.:7000 0 0, TXT "txtvers=1" "atSV=65541" "DbId=E88321B03E357E68" "CtlN=Apple TV" "DvTy=AppleTV" "DvSv=1792" "atCV=65539" "Ver=131077", TXT "txtvers=1" "atSV=65541" "hG=00000000-0c89-47bf-22ac-60ca605e4067" "MniT=167845888" "fs=2" "Name=Apple TV" "PrVs=65538" "DFID=2" "EiTS=1" "MiTPV=196611", SRV Apple-TV.local.:3689 0 0, SRV Apple-TV.local.:3689 0 0, AAAA fe80::14c3:e66d:bfb8:95fd, A 10.7.2.161, PTR Apple-TV.local., PTR Apple-TV.local. (1229)
20:57:16.573120 IP6 3f-conference.local.mdns > ff02::fb.mdns: 0*- [0q] 18/0/0 TXT "model=J33iAP", PTR _touch-able._tcp.local., PTR 5D1A9CA4F892AE29._touch-able._tcp.local., PTR _appletv-v2._tcp.local., PTR 5D1A9CA4F892AE29._appletv-v2._tcp.local., PTR 5D1A9CA4F892AE29._appletv-v2._tcp.local., TXT "deviceid=6C:94:F8:CF:0B:0F" "features=0x5A7FFFF7,0x1E" "flags=0x44" "model=AppleTV3,2" "pk=784aa331328c903ae2322adf39af17413bcd613da1de7bef5bfe03e6ee486db2" "pi=c8f58144-d619-45ca-8deb-8631de05c2f2" "srcvers=220.68" "vv=2", TXT "cn=0,1,2,3" "da=true" "et=0,3,5" "ft=0x5A7FFFF7,0x1E" "md=0,1,2" "am=AppleTV3,2" "pk=784aa331328c903ae2322adf39af17413bcd613da1de7bef5bfe03e6ee486db2" "sf=0x44" "tp=UDP" "vn=65537" "vs=220.68" "vv=2", SRV Apple-TV.local.:7000 0 0, SRV Apple-TV.local.:7000 0 0, TXT "txtvers=1" "atSV=65541" "DbId=E88321B03E357E68" "CtlN=Apple TV" "DvTy=AppleTV" "DvSv=1792" "atCV=65539" "Ver=131077", TXT "txtvers=1" "atSV=65541" "hG=00000000-0c89-47bf-22ac-60ca605e4067" "MniT=167845888" "fs=2" "Name=Apple TV" "PrVs=65538" "DFID=2" "EiTS=1" "MiTPV=196611", SRV Apple-TV.local.:3689 0 0, SRV Apple-TV.local.:3689 0 0, AAAA fe80::14c3:e66d:bfb8:95fd, A 10.7.2.161, PTR Apple-TV.local., PTR Apple-TV.local. (1229)
20:57:16.673447 IP 10.7.2.207.mdns > 224.0.0.251.mdns: 0*- [0q] 2/0/0 PTR _touch-able._tcp.local., PTR _appletv-v2._tcp.local. (97)
20:57:16.673890 IP6 3f-conference.local.mdns > ff02::fb.mdns: 0*- [0q] 2/0/0 PTR _touch-able._tcp.local., PTR _appletv-v2._tcp.local. (97)
20:57:16.731931 IP qr-in-f189.1e100.net.https > 10.7.0.170.49283: UDP, length 41
20:57:16.759561 IP 10.7.0.170.49283 > qr-in-f189.1e100.net.https: UDP, length 36
20:57:16.828758 IP 10.7.0.170.57237 > 192.243.233.3.https: Flags [P.], seq 3745581844:3745582425, ack 1783027611, win 65535, options [nop,nop,TS val 928251508 ecr 3029719475], length 581
20:57:16.852025 ARP, Request who-has 10.7.3.24 tell 10.7.3.50, length 46
20:57:16.852026 ARP, Request who-has 10.7.3.28 tell 10.7.3.50, length 46
20:57:16.852027 ARP, Request who-has 10.7.3.23 tell 10.7.3.50, length 46
20:57:16.918058 IP 192.243.233.3.https > 10.7.0.170.57237: Flags [.], ack 581, win 22659, options [nop,nop,TS val 3029748673 ecr 928251508], length 0
20:57:16.919158 IP 192.243.233.3.https > 10.7.0.170.57237: Flags [P.], seq 1:240, ack 581, win 22659, options [nop,nop,TS val 3029748674 ecr 928251508], length 239
20:57:16.919231 IP 10.7.0.170.57237 > 192.243.233.3.https: Flags [.], ack 240, win 65535, options [nop,nop,TS val 928251597 ecr 3029748674], length 0
20:57:16.999207 IP 10.7.0.170.57335 > ec2-54-187-234-31.us-west-2.compute.amazonaws.com.https: Flags [P.], seq 2499139249:2499139639, ack 1251733152, win 4096, options [nop,nop,TS val 928251676 ecr 2956621], length 390
20:57:17.103752 IP ec2-54-187-234-31.us-west-2.compute.amazonaws.com.https > 10.7.0.170.57335: Flags [P.], seq 1:778, ack 390, win 422, options [nop,nop,TS val 2957650 ecr 928251676], length 777
20:57:17.103759 IP ec2-54-187-234-31.us-west-2.compute.amazonaws.com.https > 10.7.0.170.57335: Flags [P.], seq 778:816, ack 390, win 422, options [nop,nop,TS val 2957650 ecr 928251676], length 38
20:57:17.104061 IP 10.7.0.170.57335 > ec2-54-187-234-31.us-west-2.compute.amazonaws.com.https: Flags [.], ack 778, win 4071, options [nop,nop,TS val 928251779 ecr 2957650], length 0
20:57:17.104069 IP 10.7.0.170.57335 > ec2-54-187-234-31.us-west-2.compute.amazonaws.com.https: Flags [.], ack 816, win 4070, options [nop,nop,TS val 928251779 ecr 2957650], length 0
20:57:17.112208 IP 10.7.0.170.57335 > ec2-54-187-234-31.us-west-2.compute.amazonaws.com.https: Flags [P.], seq 390:561, ack 816, win 4096, options [nop,nop,TS val 928251787 ecr 2957650], length 171
20:57:17.112462 IP 10.7.0.170.57231 > 192.229.210.181.https: Flags [P.], seq 1753376293:1753376518, ack 707291865, win 32768, length 225
20:57:17.115792 IP 192.229.210.181.https > 10.7.0.170.57231: Flags [P.], seq 1:249, ack 225, win 363, length 248
20:57:17.115794 IP 192.229.210.181.https > 10.7.0.170.57231: Flags [P.], seq 249:287, ack 225, win 363, length 38
20:57:17.115832 IP 192.229.210.181.https > 10.7.0.170.57231: Flags [.], seq 287:1747, ack 225, win 363, length 1460
20:57:17.115880 IP 10.7.0.170.57231 > 192.229.210.181.https: Flags [.], ack 249, win 32760, length 0
20:57:17.115882 IP 10.7.0.170.57231 > 192.229.210.181.https: Flags [.], ack 287, win 32759, length 0
20:57:17.116008 IP 192.229.210.181.https > 10.7.0.170.57231: Flags [.], seq 1747:3207, ack 225, win 363, length 1460
20:57:17.116038 IP 10.7.0.170.57231 > 192.229.210.181.https: Flags [.], ack 3207, win 32676, length 0
20:57:17.116127 IP 192.229.210.181.https > 10.7.0.170.57231: Flags [.], seq 3207:4667, ack 225, win 363, length 1460
20:57:17.116139 IP 10.7.0.170.57231 > 192.229.210.181.https: Flags [.], ack 3207, win 32768, length 0
20:57:17.116221 IP 192.229.210.181.https > 10.7.0.170.57231: Flags [.], seq 4667:6127, ack 225, win 363, length 1460
20:57:17.116255 IP 10.7.0.170.57231 > 192.229.210.181.https: Flags [.], ack 6127, win 32676, length 0
20:57:17.116257 IP 10.7.0.170.57231 > 192.229.210.181.https: Flags [.], ack 6127, win 32768, length 0
20:57:17.116348 IP 192.229.210.181.https > 10.7.0.170.57231: Flags [.], seq 6127:7587, ack 225, win 363, length 1460
20:57:17.116448 IP 192.229.210.181.https > 10.7.0.170.57231: Flags [.], seq 7587:9047, ack 225, win 363, length 1460
20:57:17.116477 IP 10.7.0.170.57231 > 192.229.210.181.https: Flags [.], ack 9047, win 32676, length 0
20:57:17.116577 IP 192.229.210.181.https > 10.7.0.170.57231: Flags [.], seq 9047:10507, ack 225, win 363, length 1460
20:57:17.116725 IP 192.229.210.181.https > 10.7.0.170.57231: Flags [.], seq 10507:11967, ack 225, win 363, length 1460
20:57:17.116757 IP 10.7.0.170.57231 > 192.229.210.181.https: Flags [.], ack 11967, win 32585, length 0
20:57:17.116854 IP 192.229.210.181.https > 10.7.0.170.57231: Flags [.], seq 11967:13427, ack 225, win 363, length 1460
20:57:17.116944 IP 192.229.210.181.https > 10.7.0.170.57231: Flags [.], seq 13427:14887, ack 225, win 363, length 1460
20:57:17.117085 IP 192.229.210.181.https > 10.7.0.170.57231: Flags [.], seq 14887:16347, ack 225, win 363, length 1460
20:57:17.117087 IP 192.229.210.181.https > 10.7.0.170.57231: Flags [P.], seq 16347:16699, ack 225, win 363, length 352
20:57:17.117088 IP 192.229.210.181.https > 10.7.0.170.57231: Flags [P.], seq 16699:16729, ack 225, win 363, length 30
20:57:17.117122 IP 10.7.0.170.57231 > 192.229.210.181.https: Flags [.], ack 16699, win 32711, length 0
20:57:17.117124 IP 10.7.0.170.57231 > 192.229.210.181.https: Flags [.], ack 16729, win 32710, length 0
20:57:17.117156 IP 192.229.210.181.https > 10.7.0.170.57231: Flags [P.], seq 16729:16767, ack 225, win 363, length 38
20:57:17.117183 IP 10.7.0.170.57231 > 192.229.210.181.https: Flags [.], ack 16767, win 32766, length 0
20:57:17.117268 IP 192.229.210.181.https > 10.7.0.170.57231: Flags [.], seq 16767:18227, ack 225, win 363, length 1460
20:57:17.117408 IP 192.229.210.181.https > 10.7.0.170.57231: Flags [.], seq 18227:19687, ack 225, win 363, length 1460
20:57:17.117510 IP 192.229.210.181.https > 10.7.0.170.57231: Flags [.], seq 19687:21147, ack 225, win 363, length 1460
20:57:17.117651 IP 192.229.210.181.https > 10.7.0.170.57231: Flags [.], seq 21147:22607, ack 225, win 363, length 1460
20:57:17.117829 IP 192.229.210.181.https > 10.7.0.170.57231: Flags [.], seq 22607:24067, ack 225, win 363, length 1460
20:57:17.117888 IP 192.229.210.181.https > 10.7.0.170.57231: Flags [.], seq 24067:25527, ack 225, win 363, length 1460
20:57:17.117988 IP 192.229.210.181.https > 10.7.0.170.57231: Flags [.], seq 25527:26987, ack 225, win 363, length 1460
20:57:17.118103 IP 192.229.210.181.https > 10.7.0.170.57231: Flags [.], seq 26987:28447, ack 225, win 363, length 1460
20:57:17.118143 IP 10.7.0.170.57231 > 192.229.210.181.https: Flags [.], ack 28447, win 32722, length 0
20:57:17.118247 IP 192.229.210.181.https > 10.7.0.170.57231: Flags [.], seq 28447:29907, ack 225, win 363, length 1460
20:57:17.118357 IP 192.229.210.181.https > 10.7.0.170.57231: Flags [.], seq 29907:31367, ack 225, win 363, length 1460
20:57:17.118510 IP 192.229.210.181.https > 10.7.0.170.57231: Flags [.], seq 31367:32827, ack 225, win 363, length 1460
20:57:17.118548 IP 192.229.210.181.https > 10.7.0.170.57231: Flags [P.], seq 32827:33178, ack 225, win 363, length 351
20:57:17.118549 IP 192.229.210.181.https > 10.7.0.170.57231: Flags [P.], seq 33178:33209, ack 225, win 363, length 31
20:57:17.118551 IP 192.229.210.181.https > 10.7.0.170.57231: Flags [P.], seq 33209:33247, ack 225, win 363, length 38
20:57:17.118584 IP 10.7.0.170.57231 > 192.229.210.181.https: Flags [.], ack 33178, win 32620, length 0
20:57:17.118585 IP 10.7.0.170.57231 > 192.229.210.181.https: Flags [.], ack 33209, win 32619, length 0
20:57:17.118606 IP 10.7.0.170.57231 > 192.229.210.181.https: Flags [.], ack 33247, win 32618, length 0
20:57:17.118688 IP 192.229.210.181.https > 10.7.0.170.57231: Flags [.], seq 33247:34707, ack 225, win 363, length 1460
20:57:17.118822 IP 192.229.210.181.https > 10.7.0.170.57231: Flags [.], seq 34707:36167, ack 225, win 363, length 1460
20:57:17.118919 IP 192.229.210.181.https > 10.7.0.170.57231: Flags [.], seq 36167:37627, ack 225, win 363, length 1460
20:57:17.119021 IP 192.229.210.181.https > 10.7.0.170.57231: Flags [.], seq 37627:39087, ack 225, win 363, length 1460
20:57:17.119158 IP 192.229.210.181.https > 10.7.0.170.57231: Flags [.], seq 39087:40547, ack 225, win 363, length 1460
20:57:17.119312 IP 192.229.210.181.https > 10.7.0.170.57231: Flags [.], seq 40547:42007, ack 225, win 363, length 1460
20:57:17.119437 IP 192.229.210.181.https > 10.7.0.170.57231: Flags [.], seq 42007:43467, ack 225, win 363, length 1460
20:57:17.119561 IP 192.229.210.181.https > 10.7.0.170.57231: Flags [.], seq 43467:44927, ack 225, win 363, length 1460
20:57:17.119600 IP 10.7.0.170.57231 > 192.229.210.181.https: Flags [.], ack 44927, win 32722, length 0
20:57:17.119657 IP 192.229.210.181.https > 10.7.0.170.57231: Flags [.], seq 44927:46387, ack 225, win 363, length 1460
20:57:17.119794 IP 192.229.210.181.https > 10.7.0.170.57231: Flags [.], seq 46387:47847, ack 225, win 363, length 1460
20:57:17.119923 IP 192.229.210.181.https > 10.7.0.170.57231: Flags [.], seq 47847:49307, ack 225, win 363, length 1460
20:57:17.119924 IP 192.229.210.181.https > 10.7.0.170.57231: Flags [P.], seq 49307:49657, ack 225, win 363, length 350
20:57:17.119925 IP 192.229.210.181.https > 10.7.0.170.57231: Flags [P.], seq 49657:49689, ack 225, win 363, length 32
20:57:17.119926 IP 192.229.210.181.https > 10.7.0.170.57231: Flags [P.], seq 49689:49727, ack 225, win 363, length 38
20:57:17.119962 IP 10.7.0.170.57231 > 192.229.210.181.https: Flags [.], ack 49657, win 32711, length 0
20:57:17.119964 IP 10.7.0.170.57231 > 192.229.210.181.https: Flags [.], ack 49689, win 32710, length 0
20:57:17.119990 IP 10.7.0.170.57231 > 192.229.210.181.https: Flags [.], ack 49727, win 32709, length 0
20:57:17.120060 IP 192.229.210.181.https > 10.7.0.170.57231: Flags [.], seq 49727:51187, ack 225, win 363, length 1460
20:57:17.120190 IP 192.229.210.181.https > 10.7.0.170.57231: Flags [.], seq 51187:52647, ack 225, win 363, length 1460
20:57:17.120319 IP 192.229.210.181.https > 10.7.0.170.57231: Flags [.], seq 52647:54107, ack 225, win 363, length 1460
20:57:17.120475 IP 192.229.210.181.https > 10.7.0.170.57231: Flags [.], seq 54107:55567, ack 225, win 363, length 1460
20:57:17.120595 IP 192.229.210.181.https > 10.7.0.170.57231: Flags [.], seq 55567:57027, ack 225, win 363, length 1460
20:57:17.120774 IP 192.229.210.181.https > 10.7.0.170.57231: Flags [.], seq 57027:58487, ack 225, win 363, length 1460
20:57:17.120803 IP 192.229.210.181.https > 10.7.0.170.57231: Flags [.], seq 58487:59947, ack 225, win 363, length 1460
20:57:17.120937 IP 192.229.210.181.https > 10.7.0.170.57231: Flags [.], seq 59947:61407, ack 225, win 363, length 1460
20:57:17.120972 IP 10.7.0.170.57231 > 192.229.210.181.https: Flags [.], ack 61407, win 32585, length 0
20:57:17.121033 IP 192.229.210.181.https > 10.7.0.170.57231: Flags [.], seq 61407:62867, ack 225, win 363, length 1460
20:57:17.121191 IP 192.229.210.181.https > 10.7.0.170.57231: Flags [.], seq 62867:64327, ack 225, win 363, length 1460
20:57:17.121313 IP 192.229.210.181.https > 10.7.0.170.57231: Flags [.], seq 64327:65787, ack 225, win 363, length 1460
20:57:17.121315 IP 192.229.210.181.https > 10.7.0.170.57231: Flags [P.], seq 65787:66139, ack 225, win 363, length 352
20:57:17.121316 IP 192.229.210.181.https > 10.7.0.170.57231: Flags [P.], seq 66139:66169, ack 225, win 363, length 30
20:57:17.121341 IP 192.229.210.181.https > 10.7.0.170.57231: Flags [P.], seq 66169:66207, ack 225, win 363, length 38
20:57:17.121362 IP 10.7.0.170.57231 > 192.229.210.181.https: Flags [.], ack 66139, win 32711, length 0
20:57:17.121365 IP 10.7.0.170.57231 > 192.229.210.181.https: Flags [.], ack 66169, win 32710, length 0
20:57:17.121389 IP 10.7.0.170.57231 > 192.229.210.181.https: Flags [.], ack 66207, win 32709, length 0
20:57:17.121488 IP 192.229.210.181.https > 10.7.0.170.57231: Flags [.], seq 66207:67667, ack 225, win 363, length 1460
20:57:17.121649 IP 192.229.210.181.https > 10.7.0.170.57231: Flags [.], seq 67667:69127, ack 225, win 363, length 1460
20:57:17.121706 IP 192.229.210.181.https > 10.7.0.170.57231: Flags [.], seq 69127:70587, ack 225, win 363, length 1460
20:57:17.121879 IP 192.229.210.181.https > 10.7.0.170.57231: Flags [.], seq 70587:72047, ack 225, win 363, length 1460
20:57:17.122012 IP 192.229.210.181.https > 10.7.0.170.57231: Flags [.], seq 72047:73507, ack 225, win 363, length 1460
20:57:17.122071 IP 192.229.210.181.https > 10.7.0.170.57231: Flags [.], seq 73507:74967, ack 225, win 363, length 1460
20:57:17.122248 IP 192.229.210.181.https > 10.7.0.170.57231: Flags [.], seq 74967:76427, ack 225, win 363, length 1460
20:57:17.122359 IP 192.229.210.181.https > 10.7.0.170.57231: Flags [.], seq 76427:77887, ack 225, win 363, length 1460
20:57:17.122402 IP 10.7.0.170.57231 > 192.229.210.181.https: Flags [.], ack 77887, win 32722, length 0
20:57:17.122447 IP 192.229.210.181.https > 10.7.0.170.57231: Flags [.], seq 77887:79347, ack 225, win 363, length 1460
20:57:17.122580 IP 192.229.210.181.https > 10.7.0.170.57231: Flags [.], seq 79347:80807, ack 225, win 363, length 1460
20:57:17.122764 IP 192.229.210.181.https > 10.7.0.170.57231: Flags [.], seq 80807:82267, ack 225, win 363, length 1460
20:57:17.122766 IP 192.229.210.181.https > 10.7.0.170.57231: Flags [P.], seq 82267:82618, ack 225, win 363, length 351
20:57:17.122767 IP 192.229.210.181.https > 10.7.0.170.57231: Flags [P.], seq 82618:82649, ack 225, win 363, length 31
20:57:17.122768 IP 192.229.210.181.https > 10.7.0.170.57231: Flags [P.], seq 82649:82687, ack 225, win 363, length 38
20:57:17.122808 IP 10.7.0.170.57231 > 192.229.210.181.https: Flags [.], ack 82618, win 32711, length 0
20:57:17.122809 IP 10.7.0.170.57231 > 192.229.210.181.https: Flags [.], ack 82649, win 32710, length 0
20:57:17.122833 IP 10.7.0.170.57231 > 192.229.210.181.https: Flags [.], ack 82687, win 32709, length 0
20:57:17.122938 IP 192.229.210.181.https > 10.7.0.170.57231: Flags [.], seq 82687:84147, ack 225, win 363, length 1460
20:57:17.123039 IP 192.229.210.181.https > 10.7.0.170.57231: Flags [.], seq 84147:85607, ack 225, win 363, length 1460
20:57:17.123040 IP 10.7.0.251.netbios-ns > 10.7.3.255.netbios-ns: NBT UDP PACKET(137): QUERY; REQUEST; BROADCAST
20:57:17.123147 IP 192.229.210.181.https > 10.7.0.170.57231: Flags [.], seq 85607:87067, ack 225, win 363, length 1460
20:57:17.123269 IP 192.229.210.181.https > 10.7.0.170.57231: Flags [.], seq 87067:88527, ack 225, win 363, length 1460
20:57:17.123408 IP 192.229.210.181.https > 10.7.0.170.57231: Flags [.], seq 88527:89987, ack 225, win 363, length 1460
20:57:17.123509 IP 192.229.210.181.https > 10.7.0.170.57231: Flags [.], seq 89987:91447, ack 225, win 363, length 1460
20:57:17.123650 IP 192.229.210.181.https > 10.7.0.170.57231: Flags [.], seq 91447:92907, ack 225, win 363, length 1460
20:57:17.123802 IP 192.229.210.181.https > 10.7.0.170.57231: Flags [.], seq 92907:94367, ack 225, win 363, length 1460
20:57:17.123844 IP 10.7.0.170.57231 > 192.229.210.181.https: Flags [.], ack 94367, win 32722, length 0
20:57:17.123888 IP 192.229.210.181.https > 10.7.0.170.57231: Flags [.], seq 94367:95827, ack 225, win 363, length 1460
20:57:17.124025 IP 192.229.210.181.https > 10.7.0.170.57231: Flags [.], seq 95827:97287, ack 225, win 363, length 1460
20:57:17.124306 IP 192.229.210.181.https > 10.7.0.170.57231: Flags [.], seq 97287:98747, ack 225, win 363, length 1460
20:57:17.124308 IP 192.229.210.181.https > 10.7.0.170.57231: Flags [P.], seq 98747:99097, ack 225, win 363, length 350
20:57:17.124310 IP 192.229.210.181.https > 10.7.0.170.57231: Flags [P.], seq 99097:99129, ack 225, win 363, length 32
20:57:17.124310 IP 192.229.210.181.https > 10.7.0.170.57231: Flags [P.], seq 99129:99167, ack 225, win 363, length 38
20:57:17.124324 IP 192.229.210.181.https > 10.7.0.170.57231: Flags [.], seq 99167:100627, ack 225, win 363, length 1460
20:57:17.124355 IP 10.7.0.170.57231 > 192.229.210.181.https: Flags [.], ack 99097, win 32711, length 0
20:57:17.124357 IP 10.7.0.170.57231 > 192.229.210.181.https: Flags [.], ack 99129, win 32767, length 0
20:57:17.124384 IP 10.7.0.170.57231 > 192.229.210.181.https: Flags [.], ack 99167, win 32765, length 0
20:57:17.124422 IP 192.229.210.181.https > 10.7.0.170.57231: Flags [.], seq 100627:102087, ack 225, win 363, length 1460
20:57:17.124529 IP 192.229.210.181.https > 10.7.0.170.57231: Flags [.], seq 102087:103547, ack 225, win 363, length 1460
20:57:17.124660 IP 192.229.210.181.https > 10.7.0.170.57231: Flags [.], seq 103547:105007, ack 225, win 363, length 1460
20:57:17.124821 IP 192.229.210.181.https > 10.7.0.170.57231: Flags [.], seq 105007:106467, ack 225, win 363, length 1460
20:57:17.124923 IP 192.229.210.181.https > 10.7.0.170.57231: Flags [.], seq 106467:107927, ack 225, win 363, length 1460
20:57:17.125044 IP 192.229.210.181.https > 10.7.0.170.57231: Flags [.], seq 107927:109387, ack 225, win 363, length 1460
20:57:17.125148 IP 192.229.210.181.https > 10.7.0.170.57231: Flags [.], seq 109387:110847, ack 225, win 363, length 1460
20:57:17.125190 IP 10.7.0.170.57231 > 192.229.210.181.https: Flags [.], ack 110847, win 32722, length 0
20:57:17.125291 IP 192.229.210.181.https > 10.7.0.170.57231: Flags [.], seq 110847:112307, ack 225, win 363, length 1460
20:57:17.125443 IP 192.229.210.181.https > 10.7.0.170.57231: Flags [.], seq 112307:113767, ack 225, win 363, length 1460
20:57:17.125576 IP 192.229.210.181.https > 10.7.0.170.57231: Flags [.], seq 113767:115227, ack 225, win 363, length 1460
20:57:17.125577 IP 192.229.210.181.https > 10.7.0.170.57231: Flags [P.], seq 115227:115576, ack 225, win 363, length 349
20:57:17.125578 IP 192.229.210.181.https > 10.7.0.170.57231: Flags [P.], seq 115576:115609, ack 225, win 363, length 33
20:57:17.125579 IP 192.229.210.181.https > 10.7.0.170.57231: Flags [P.], seq 115609:115647, ack 225, win 363, length 38
20:57:17.125623 IP 10.7.0.170.57231 > 192.229.210.181.https: Flags [.], ack 115576, win 32711, length 0
20:57:17.125625 IP 10.7.0.170.57231 > 192.229.210.181.https: Flags [.], ack 115609, win 32710, length 0
20:57:17.125659 IP 10.7.0.170.57231 > 192.229.210.181.https: Flags [.], ack 115647, win 32766, length 0
20:57:17.125806 IP 192.229.210.181.https > 10.7.0.170.57231: Flags [.], seq 115647:117107, ack 225, win 363, length 1460
20:57:17.125847 IP 192.229.210.181.https > 10.7.0.170.57231: Flags [.], seq 117107:118567, ack 225, win 363, length 1460
20:57:17.125967 IP 192.229.210.181.https > 10.7.0.170.57231: Flags [.], seq 118567:120027, ack 225, win 363, length 1460
20:57:17.126097 IP 192.229.210.181.https > 10.7.0.170.57231: Flags [.], seq 120027:121487, ack 225, win 363, length 1460
20:57:17.126193 IP 192.229.210.181.https > 10.7.0.170.57231: Flags [.], seq 121487:122947, ack 225, win 363, length 1460
20:57:17.126321 IP 192.229.210.181.https > 10.7.0.170.57231: Flags [.], seq 122947:124407, ack 225, win 363, length 1460
20:57:17.126473 IP 192.229.210.181.https > 10.7.0.170.57231: Flags [.], seq 124407:125867, ack 225, win 363, length 1460
20:57:17.126567 IP 192.229.210.181.https > 10.7.0.170.57231: Flags [.], seq 125867:127327, ack 225, win 363, length 1460
20:57:17.126597 IP 10.7.0.170.57231 > 192.229.210.181.https: Flags [.], ack 127327, win 32676, length 0
20:57:17.126776 IP 192.229.210.181.https > 10.7.0.170.57231: Flags [.], seq 127327:128787, ack 225, win 363, length 1460
20:57:17.126834 IP 192.229.210.181.https > 10.7.0.170.57231: Flags [.], seq 128787:130247, ack 225, win 363, length 1460
20:57:17.126968 IP 192.229.210.181.https > 10.7.0.170.57231: Flags [.], seq 130247:131707, ack 225, win 363, length 1460
20:57:17.126970 IP 192.229.210.181.https > 10.7.0.170.57231: Flags [P.], seq 131707:132055, ack 225, win 363, length 348
20:57:17.126971 IP 192.229.210.181.https > 10.7.0.170.57231: Flags [P.], seq 132055:132089, ack 225, win 363, length 34
20:57:17.126973 IP 192.229.210.181.https > 10.7.0.170.57231: Flags [P.], seq 132089:132127, ack 225, win 363, length 38
20:57:17.127014 IP 10.7.0.170.57231 > 192.229.210.181.https: Flags [.], ack 132055, win 32711, length 0
20:57:17.127016 IP 10.7.0.170.57231 > 192.229.210.181.https: Flags [.], ack 132089, win 32710, length 0
20:57:17.127040 IP 10.7.0.170.57231 > 192.229.210.181.https: Flags [.], ack 132127, win 32709, length 0
20:57:17.127106 IP 192.229.210.181.https > 10.7.0.170.57231: Flags [.], seq 132127:133587, ack 225, win 363, length 1460
20:57:17.127257 IP 192.229.210.181.https > 10.7.0.170.57231: Flags [.], seq 133587:135047, ack 225, win 363, length 1460
20:57:17.127351 IP 192.229.210.181.https > 10.7.0.170.57231: Flags [.], seq 135047:136507, ack 225, win 363, length 1460
20:57:17.127478 IP 192.229.210.181.https > 10.7.0.170.57231: Flags [.], seq 136507:137967, ack 225, win 363, length 1460
20:57:17.127619 IP 192.229.210.181.https > 10.7.0.170.57231: Flags [.], seq 137967:139427, ack 225, win 363, length 1460
20:57:17.127797 IP 192.229.210.181.https > 10.7.0.170.57231: Flags [.], seq 139427:140887, ack 225, win 363, length 1460
20:57:17.127834 IP 192.229.210.181.https > 10.7.0.170.57231: Flags [.], seq 140887:142347, ack 225, win 363, length 1460
20:57:17.127995 IP 192.229.210.181.https > 10.7.0.170.57231: Flags [.], seq 142347:143807, ack 225, win 363, length 1460
20:57:17.128045 IP 10.7.0.170.57231 > 192.229.210.181.https: Flags [.], ack 143807, win 32722, length 0
20:57:17.128147 IP 192.229.210.181.https > 10.7.0.170.57231: Flags [.], seq 143807:145267, ack 225, win 363, length 1460
20:57:17.128231 IP 192.229.210.181.https > 10.7.0.170.57231: Flags [.], seq 145267:146727, ack 225, win 363, length 1460
20:57:17.128319 IP 192.229.210.181.https > 10.7.0.170.57231: Flags [.], seq 146727:148187, ack 225, win 363, length 1460
20:57:17.128358 IP 192.229.210.181.https > 10.7.0.170.57231: Flags [P.], seq 148187:148534, ack 225, win 363, length 347
20:57:17.128360 IP 192.229.210.181.https > 10.7.0.170.57231: Flags [P.], seq 148534:148569, ack 225, win 363, length 35
20:57:17.128401 IP 10.7.0.170.57231 > 192.229.210.181.https: Flags [.], ack 148534, win 32757, length 0
20:57:17.128403 IP 10.7.0.170.57231 > 192.229.210.181.https: Flags [.], ack 148569, win 32756, length 0
20:57:17.128446 IP 192.229.210.181.https > 10.7.0.170.57231: Flags [P.], seq 148569:148607, ack 225, win 363, length 38
20:57:17.128474 IP 10.7.0.170.57231 > 192.229.210.181.https: Flags [.], ack 148607, win 32766, length 0
20:57:17.128528 IP 192.229.210.181.https > 10.7.0.170.57231: Flags [.], seq 148607:150067, ack 225, win 363, length 1460
20:57:17.128649 IP 192.229.210.181.https > 10.7.0.170.57231: Flags [.], seq 150067:151527, ack 225, win 363, length 1460
20:57:17.128799 IP 192.229.210.181.https > 10.7.0.170.57231: Flags [.], seq 151527:152987, ack 225, win 363, length 1460
20:57:17.128913 IP 192.229.210.181.https > 10.7.0.170.57231: Flags [.], seq 152987:154447, ack 225, win 363, length 1460
20:57:17.129164 IP 192.229.210.181.https > 10.7.0.170.57231: Flags [.], seq 154447:155907, ack 225, win 363, length 1460
20:57:17.129166 IP 192.229.210.181.https > 10.7.0.170.57231: Flags [.], seq 155907:157367, ack 225, win 363, length 1460
20:57:17.129475 IP 192.229.210.181.https > 10.7.0.170.57231: Flags [.], seq 157367:158827, ack 225, win 363, length 1460
20:57:17.129477 IP 192.229.210.181.https > 10.7.0.170.57231: Flags [.], seq 158827:160287, ack 225, win 363, length 1460
20:57:17.129527 IP 10.7.0.170.57231 > 192.229.210.181.https: Flags [.], ack 160287, win 32676, length 0
20:57:17.129680 IP 192.229.210.181.https > 10.7.0.170.57231: Flags [.], seq 160287:161747, ack 225, win 363, length 1460
20:57:17.129885 IP 192.229.210.181.https > 10.7.0.170.57231: Flags [.], seq 161747:163207, ack 225, win 363, length 1460
20:57:17.129887 IP 192.229.210.181.https > 10.7.0.170.57231: Flags [.], seq 163207:164667, ack 225, win 363, length 1460
20:57:17.129889 IP 192.229.210.181.https > 10.7.0.170.57231: Flags [P.], seq 164667:165013, ack 225, win 363, length 346
20:57:17.129890 IP 192.229.210.181.https > 10.7.0.170.57231: Flags [P.], seq 165013:165049, ack 225, win 363, length 36
20:57:17.129891 IP 192.229.210.181.https > 10.7.0.170.57231: Flags [P.], seq 165049:165087, ack 225, win 363, length 38
20:57:17.129936 IP 10.7.0.170.57231 > 192.229.210.181.https: Flags [.], ack 165013, win 32665, length 0
20:57:17.129938 IP 10.7.0.170.57231 > 192.229.210.181.https: Flags [.], ack 165049, win 32664, length 0
20:57:17.129967 IP 10.7.0.170.57231 > 192.229.210.181.https: Flags [.], ack 165087, win 32663, length 0
20:57:17.129983 IP 192.229.210.181.https > 10.7.0.170.57231: Flags [.], seq 165087:166547, ack 225, win 363, length 1460
20:57:17.130036 IP 192.229.210.181.https > 10.7.0.170.57231: Flags [.], seq 166547:168007, ack 225, win 363, length 1460
20:57:17.130170 IP 192.229.210.181.https > 10.7.0.170.57231: Flags [.], seq 168007:169467, ack 225, win 363, length 1460
20:57:17.130303 IP 192.229.210.181.https > 10.7.0.170.57231: Flags [.], seq 169467:170927, ack 225, win 363, length 1460
20:57:17.130408 IP 192.229.210.181.https > 10.7.0.170.57231: Flags [.], seq 170927:172387, ack 225, win 363, length 1460
20:57:17.130543 IP 192.229.210.181.https > 10.7.0.170.57231: Flags [.], seq 172387:173847, ack 225, win 363, length 1460
20:57:17.130727 IP 192.229.210.181.https > 10.7.0.170.57231: Flags [.], seq 173847:175307, ack 225, win 363, length 1460
20:57:17.130798 IP 192.229.210.181.https > 10.7.0.170.57231: Flags [.], seq 175307:176767, ack 225, win 363, length 1460
20:57:17.130835 IP 10.7.0.170.57231 > 192.229.210.181.https: Flags [.], ack 176767, win 32676, length 0
20:57:17.130902 IP 192.229.210.181.https > 10.7.0.170.57231: Flags [.], seq 176767:178227, ack 225, win 363, length 1460
20:57:17.131043 IP 192.229.210.181.https > 10.7.0.170.57231: Flags [.], seq 178227:179687, ack 225, win 363, length 1460
20:57:17.131194 IP 192.229.210.181.https > 10.7.0.170.57231: Flags [.], seq 179687:181147, ack 225, win 363, length 1460
20:57:17.131195 IP 192.229.210.181.https > 10.7.0.170.57231: Flags [P.], seq 181147:181492, ack 225, win 363, length 345
20:57:17.131197 IP 192.229.210.181.https > 10.7.0.170.57231: Flags [P.], seq 181492:181529, ack 225, win 363, length 37
20:57:17.131198 IP 192.229.210.181.https > 10.7.0.170.57231: Flags [P.], seq 181529:181567, ack 225, win 363, length 38
20:57:17.131250 IP 10.7.0.170.57231 > 192.229.210.181.https: Flags [.], ack 181492, win 32711, length 0
20:57:17.131252 IP 10.7.0.170.57231 > 192.229.210.181.https: Flags [.], ack 181529, win 32710, length 0
20:57:17.131253 IP 10.7.0.170.57231 > 192.229.210.181.https: Flags [.], ack 181567, win 32709, length 0
20:57:17.131346 IP 192.229.210.181.https > 10.7.0.170.57231: Flags [.], seq 181567:183027, ack 225, win 363, length 1460
20:57:17.131467 IP 192.229.210.181.https > 10.7.0.170.57231: Flags [.], seq 183027:184487, ack 225, win 363, length 1460
20:57:17.131564 IP 192.229.210.181.https > 10.7.0.170.57231: Flags [.], seq 184487:185947, ack 225, win 363, length 1460
20:57:17.131697 IP 192.229.210.181.https > 10.7.0.170.57231: Flags [.], seq 185947:187407, ack 225, win 363, length 1460
20:57:17.131828 IP 192.229.210.181.https > 10.7.0.170.57231: Flags [.], seq 187407:188867, ack 225, win 363, length 1460
20:57:17.131934 IP 192.229.210.181.https > 10.7.0.170.57231: Flags [.], seq 188867:190327, ack 225, win 363, length 1460
20:57:17.132064 IP 192.229.210.181.https > 10.7.0.170.57231: Flags [.], seq 190327:191787, ack 225, win 363, length 1460
20:57:17.132198 IP 192.229.210.181.https > 10.7.0.170.57231: Flags [.], seq 191787:193247, ack 225, win 363, length 1460
20:57:17.132242 IP 10.7.0.170.57231 > 192.229.210.181.https: Flags [.], ack 193247, win 32722, length 0
20:57:17.132310 IP 192.229.210.181.https > 10.7.0.170.57231: Flags [.], seq 193247:194707, ack 225, win 363, length 1460
20:57:17.132418 IP 192.229.210.181.https > 10.7.0.170.57231: Flags [.], seq 194707:196167, ack 225, win 363, length 1460
20:57:17.132556 IP 192.229.210.181.https > 10.7.0.170.57231: Flags [.], seq 196167:197627, ack 225, win 363, length 1460
20:57:17.132558 IP 192.229.210.181.https > 10.7.0.170.57231: Flags [P.], seq 197627:197971, ack 225, win 363, length 344
20:57:17.132559 IP 192.229.210.181.https > 10.7.0.170.57231: Flags [P.], seq 197971:198009, ack 225, win 363, length 38
20:57:17.132593 IP 192.229.210.181.https > 10.7.0.170.57231: Flags [P.], seq 198009:198047, ack 225, win 363, length 38
20:57:17.132605 IP 10.7.0.170.57231 > 192.229.210.181.https: Flags [.], ack 197971, win 32711, length 0
20:57:17.132607 IP 10.7.0.170.57231 > 192.229.210.181.https: Flags [.], ack 198009, win 32710, length 0
20:57:17.132632 IP 10.7.0.170.57231 > 192.229.210.181.https: Flags [.], ack 198047, win 32709, length 0
20:57:17.132724 IP 192.229.210.181.https > 10.7.0.170.57231: Flags [.], seq 198047:199507, ack 225, win 363, length 1460
20:57:17.132862 IP 192.229.210.181.https > 10.7.0.170.57231: Flags [.], seq 199507:200967, ack 225, win 363, length 1460
20:57:17.132982 IP 192.229.210.181.https > 10.7.0.170.57231: Flags [.], seq 200967:202427, ack 225, win 363, length 1460
20:57:17.133116 IP 192.229.210.181.https > 10.7.0.170.57231: Flags [.], seq 202427:203887, ack 225, win 363, length 1460
20:57:17.133234 IP 192.229.210.181.https > 10.7.0.170.57231: Flags [.], seq 203887:205347, ack 225, win 363, length 1460
20:57:17.133348 IP 192.229.210.181.https > 10.7.0.170.57231: Flags [.], seq 205347:206807, ack 225, win 363, length 1460
20:57:17.133540 IP 192.229.210.181.https > 10.7.0.170.57231: Flags [.], seq 206807:208267, ack 225, win 363, length 1460
20:57:17.133596 IP 192.229.210.181.https > 10.7.0.170.57231: Flags [.], seq 208267:209727, ack 225, win 363, length 1460
20:57:17.133643 IP 10.7.0.170.57231 > 192.229.210.181.https: Flags [.], ack 209727, win 32722, length 0
20:57:17.133830 IP 192.229.210.181.https > 10.7.0.170.57231: Flags [.], seq 209727:211187, ack 225, win 363, length 1460
20:57:17.133831 IP 192.229.210.181.https > 10.7.0.170.57231: Flags [.], seq 211187:212647, ack 225, win 363, length 1460
20:57:17.134006 IP 192.229.210.181.https > 10.7.0.170.57231: Flags [.], seq 212647:214107, ack 225, win 363, length 1460
20:57:17.134008 IP 192.229.210.181.https > 10.7.0.170.57231: Flags [P.], seq 214107:214450, ack 225, win 363, length 343
20:57:17.134009 IP 192.229.210.181.https > 10.7.0.170.57231: Flags [P.], seq 214450:214489, ack 225, win 363, length 39
20:57:17.134010 IP 192.229.210.181.https > 10.7.0.170.57231: Flags [P.], seq 214489:214527, ack 225, win 363, length 38
20:57:17.134045 IP 10.7.0.170.57231 > 192.229.210.181.https: Flags [.], ack 214450, win 32711, length 0
20:57:17.134047 IP 10.7.0.170.57231 > 192.229.210.181.https: Flags [.], ack 214489, win 32710, length 0
20:57:17.134065 IP 10.7.0.170.57231 > 192.229.210.181.https: Flags [.], ack 214527, win 32709, length 0
20:57:17.134152 IP 192.229.210.181.https > 10.7.0.170.57231: Flags [.], seq 214527:215987, ack 225, win 363, length 1460
20:57:17.134240 IP 192.229.210.181.https > 10.7.0.170.57231: Flags [.], seq 215987:217447, ack 225, win 363, length 1460
20:57:17.134416 IP 192.229.210.181.https > 10.7.0.170.57231: Flags [.], seq 217447:218907, ack 225, win 363, length 1460
20:57:17.134522 IP 192.229.210.181.https > 10.7.0.170.57231: Flags [.], seq 218907:220367, ack 225, win 363, length 1460
20:57:17.134639 IP 192.229.210.181.https > 10.7.0.170.57231: Flags [.], seq 220367:221827, ack 225, win 363, length 1460
20:57:17.134825 IP 192.229.210.181.https > 10.7.0.170.57231: Flags [.], seq 221827:223287, ack 225, win 363, length 1460
20:57:17.134854 IP 192.229.210.181.https > 10.7.0.170.57231: Flags [.], seq 223287:224747, ack 225, win 363, length 1460
20:57:17.135054 IP 192.229.210.181.https > 10.7.0.170.57231: Flags [.], seq 224747:226207, ack 225, win 363, length 1460
20:57:17.135095 IP 10.7.0.170.57231 > 192.229.210.181.https: Flags [.], ack 226207, win 32631, length 0
20:57:17.135144 IP 192.229.210.181.https > 10.7.0.170.57231: Flags [.], seq 226207:227667, ack 225, win 363, length 1460
20:57:17.135249 IP 192.229.210.181.https > 10.7.0.170.57231: Flags [.], seq 227667:229127, ack 225, win 363, length 1460
20:57:17.135394 IP 192.229.210.181.https > 10.7.0.170.57231: Flags [.], seq 229127:230587, ack 225, win 363, length 1460
20:57:17.135395 IP 192.229.210.181.https > 10.7.0.170.57231: Flags [P.], seq 230587:230929, ack 225, win 363, length 342
20:57:17.135396 IP 192.229.210.181.https > 10.7.0.170.57231: Flags [P.], seq 230929:230969, ack 225, win 363, length 40
20:57:17.135429 IP 192.229.210.181.https > 10.7.0.170.57231: Flags [P.], seq 230969:231007, ack 225, win 363, length 38
20:57:17.135440 IP 10.7.0.170.57231 > 192.229.210.181.https: Flags [.], ack 230929, win 32483, length 0
20:57:17.135442 IP 10.7.0.170.57231 > 192.229.210.181.https: Flags [.], ack 230969, win 32482, length 0
20:57:17.135443 IP 10.7.0.170.57231 > 192.229.210.181.https: Flags [.], ack 231007, win 32481, length 0
20:57:17.135548 IP 192.229.210.181.https > 10.7.0.170.57231: Flags [.], seq 231007:232467, ack 225, win 363, length 1460
20:57:17.135665 IP 192.229.210.181.https > 10.7.0.170.57231: Flags [.], seq 232467:233927, ack 225, win 363, length 1460
20:57:17.135796 IP 192.229.210.181.https > 10.7.0.170.57231: Flags [.], seq 233927:235387, ack 225, win 363, length 1460
20:57:17.135903 IP 192.229.210.181.https > 10.7.0.170.57231: Flags [.], seq 235387:236847, ack 225, win 363, length 1460
20:57:17.136043 IP 192.229.210.181.https > 10.7.0.170.57231: Flags [.], seq 236847:238307, ack 225, win 363, length 1460
20:57:17.136169 IP 192.229.210.181.https > 10.7.0.170.57231: Flags [.], seq 238307:239767, ack 225, win 363, length 1460
20:57:17.136270 IP 192.229.210.181.https > 10.7.0.170.57231: Flags [.], seq 239767:241227, ack 225, win 363, length 1460
20:57:17.136409 IP 192.229.210.181.https > 10.7.0.170.57231: Flags [.], seq 241227:242687, ack 225, win 363, length 1460
20:57:17.136452 IP 10.7.0.170.57231 > 192.229.210.181.https: Flags [.], ack 242687, win 32722, length 0
20:57:17.136560 IP 192.229.210.181.https > 10.7.0.170.57231: Flags [.], seq 242687:244147, ack 225, win 363, length 1460
20:57:17.136672 IP 192.229.210.181.https > 10.7.0.170.57231: Flags [.], seq 244147:245607, ack 225, win 363, length 1460
20:57:17.136802 IP 192.229.210.181.https > 10.7.0.170.57231: Flags [.], seq 245607:247067, ack 225, win 363, length 1460
20:57:17.136804 IP 192.229.210.181.https > 10.7.0.170.57231: Flags [P.], seq 247067:247419, ack 225, win 363, length 352
20:57:17.136806 IP 192.229.210.181.https > 10.7.0.170.57231: Flags [P.], seq 247419:247449, ack 225, win 363, length 30
20:57:17.136807 IP 192.229.210.181.https > 10.7.0.170.57231: Flags [P.], seq 247449:247487, ack 225, win 363, length 38
20:57:17.136843 IP 10.7.0.170.57231 > 192.229.210.181.https: Flags [.], ack 247419, win 32711, length 0
20:57:17.136845 IP 10.7.0.170.57231 > 192.229.210.181.https: Flags [.], ack 247449, win 32710, length 0
20:57:17.136867 IP 10.7.0.170.57231 > 192.229.210.181.https: Flags [.], ack 247487, win 32709, length 0
20:57:17.136932 IP 192.229.210.181.https > 10.7.0.170.57231: Flags [.], seq 247487:248947, ack 225, win 363, length 1460
20:57:17.137067 IP 192.229.210.181.https > 10.7.0.170.57231: Flags [.], seq 248947:250407, ack 225, win 363, length 1460
20:57:17.137204 IP 192.229.210.181.https > 10.7.0.170.57231: Flags [.], seq 250407:251867, ack 225, win 363, length 1460
20:57:17.137206 IP 192.229.210.181.https > 10.7.0.170.57231: Flags [P.], seq 251867:252188, ack 225, win 363, length 321
20:57:17.137245 IP 10.7.0.170.57231 > 192.229.210.181.https: Flags [.], ack 252188, win 32712, length 0
20:57:17.140030 STP 802.1w, Rapid STP, Flags [Learn, Forward], bridge-id 8000.00:18:0a:b6:de:8f.8005, length 43
20:57:17.210113 IP ec2-54-187-234-31.us-west-2.compute.amazonaws.com.https > 10.7.0.170.57335: Flags [P.], seq 816:1067, ack 561, win 422, options [nop,nop,TS val 2957677 ecr 928251787], length 251
20:57:17.210114 IP ec2-54-187-234-31.us-west-2.compute.amazonaws.com.https > 10.7.0.170.57335: Flags [P.], seq 1067:1105, ack 561, win 422, options [nop,nop,TS val 2957677 ecr 928251787], length 38
20:57:17.210212 IP 10.7.0.170.57335 > ec2-54-187-234-31.us-west-2.compute.amazonaws.com.https: Flags [.], ack 1067, win 4088, options [nop,nop,TS val 928251883 ecr 2957677], length 0
20:57:17.210214 IP 10.7.0.170.57335 > ec2-54-187-234-31.us-west-2.compute.amazonaws.com.https: Flags [.], ack 1105, win 4086, options [nop,nop,TS val 928251883 ecr 2957677], length 0
20:57:17.250532 IP 10.7.0.170.57335 > ec2-54-187-234-31.us-west-2.compute.amazonaws.com.https: Flags [P.], seq 561:951, ack 1105, win 4096, options [nop,nop,TS val 928251923 ecr 2957677], length 390
20:57:17.289761 ARP, Request who-has 10.7.3.29 tell 10.7.3.50, length 46
20:57:17.296839 IP 10.7.0.170.65496 > resolver1.opendns.com.domain: 31151+ PTR? 207.2.7.10.in-addr.arpa. (41)
20:57:17.300612 IP resolver1.opendns.com.domain > 10.7.0.170.65496: 31151* 0/1/0 (100)
20:57:17.351863 ARP, Request who-has 10.7.3.125 tell 10.7.3.50, length 46
20:57:17.352882 IP ec2-54-187-234-31.us-west-2.compute.amazonaws.com.https > 10.7.0.170.57335: Flags [P.], seq 1105:1881, ack 951, win 422, options [nop,nop,TS val 2957712 ecr 928251923], length 776
